,Clause,Implicit,Explicit,Unspecified,not-selected
592,Any parent or guardian of a child under 13 years of age who may have provided personally-identifiable information to us may request a description of the personally-identifiable information that has been collected from or about that child and either limit or restrict any further maintenance or use of such information from that child and/or direct us to delete it.,0.0,1.0,0.0,0.0
593,We will not knowingly use or disclose any personally-identifiable information of a child under 13 years of age for any purpose except as described above.  ,0.0,0.0,1.0,0.0
594," What information about you do we collect?    By accessing or using the Sites, you may provide to us two types of information: (1) ""personally-identifiable information"" that you voluntarily choose to disclose to us, such as your name, address, telephone number, e-mail address, and credit card, debit card or other payment information; and (2) ""non-personally-identifiable information,"" which we collect through the use of the technologies called ""cookies,"" ""web beacons"" and/or ""web logs."" We use the information we collect to monitor and analyze how users use the Sites and the Services, to provide customer service and to maintain and improve the Services. We may also collect technical information to help us identify your mobile device.  ",0.0,1.0,1.0,0.0
595,we collect through t,1.0,0.0,0.0,0.0
596,that you voluntarily choose to disclose to us,0.0,1.0,0.0,0.0
597,"By accessing or using the Sites, you may provide to us two types of information: (1) ""personally-identifiable information"" that you voluntarily choose to disclose to us, such as your name, address, telephone number, e-mail address, and credit card, debit card or other payment information; and (2) ""non-personally-identifiable information,"" which we collect through the use of the technologies called ""cookies,"" ""web beacons"" and/or ""web logs.""",1.0,0.0,0.0,0.0
598,We may also collect technical information to help us identify your mobile device.,1.0,0.0,0.0,0.0
599,voluntarily choose to disclose to us,0.0,1.0,0.0,0.0
600,asked to submit,0.0,1.0,0.0,0.0
601,You may be asked to submit personally-identifiable information,0.0,1.0,0.0,0.0
602,"You may be asked to submit personally-identifiable information to access or use certain aspects of the Services offered on the Sites - for example, when you create an account, subscribe to our mailing list, purchase a product, contact us, receive customer or technical support, or participate in chat rooms, forums, polls, surveys, questionnaires, contests, sweepstakes or other promotions. If you choose not to submit the requested personally-identifiable information, you will not be able to access or use some or all of these Services. We may also collect other types of information about you, such as your gender, hobbies and interests, and this information may be associated with your personally-identifiable information.  ",0.0,0.0,1.0,0.0
603,You may be asked to submit,0.0,1.0,0.0,0.0
604,"We use ""cookies"" to collect information, on an aggregate basis, about how the Sites are used. This information may include the date and time of visits to the Sites and time spent on the Sites. The use of ""cookies"" allows us to personalize your use of the Sites and to provide greater convenience each time that you visit. You may choose to disable cookies on your computer, block all cookies, or receive a warning before a cookie is stored on your computer (please consult instructions for your web browser). However, if you disable or block cookies, it is possible that some parts of the Services will not be accessible to you.  ",0.0,0.0,1.0,0.0
605,to collect information,1.0,0.0,0.0,0.0
606,automatically record information that your browser sends whenever you visit the Sites,1.0,0.0,0.0,0.0
607,We do not participate in tracking networks,1.0,0.0,0.0,0.0
608," Personal Information Collected Via Our Services     Information You Provide.  You may visit and enjoy many elements of our Services without disclosing any personal information about yourself. However, to make use of select, special or enhanced elements of the Services, you will need to share with us certain personal information so those elements may function properly. When you use certain enhanced elements within our Services (e.g., create a profile, register for a promotion, make a purchase, or publish a comment), the personal information we collect may include, but is not limited to:     Full name,    Email address,    Password,    Street address,    Telephone number(s),    Birth date,    Payment card information,    Location data,    Contacts (as stored in your wireless device),    Other personal data as detailed in this Privacy Policy and data that may be requested from and provided by you.  ",0.0,0.0,1.0,0.0
609,share with us certain personal information,0.0,1.0,0.0,0.0
610,Information You Provide,0.0,1.0,0.0,0.0
611,you to grant permission,0.0,1.0,0.0,0.0
612,"If we collect such information, in most instances, the applicable page(s) or location(s) within the Services will include statements regarding what information is required for the elements of the Services to function properly and functionality for you to submit the requested or required information. In addition to the list above, there may also be opportunities for you to grant permission for use of other of your information in a manner set forth on the applicable page(s) within the Services.  ",0.0,0.0,1.0,0.0
613,you submit personal information to us,0.0,1.0,0.0,0.0
614," How We Use and Share Your Personal Information    If you submit personal information to us, or to any third party acting on our behalf, we may use and share your information as set forth in this Privacy Policy and as disclosed when you first submit your information or as permissible under applicable law. We will not sell, lease, publish or share your personal information with or to anyone else, except as set forth in this Privacy Policy. We may use and share your personal information as described in Section 1 above and we may:  ",0.0,0.0,1.0,0.0
615,submit your information,0.0,1.0,0.0,0.0
616,or as permissible under applicable law,1.0,0.0,0.0,0.0
617,"If you submit personal information to us, or to any third party acting on our behalf, we may use and share your information as set forth in this Privacy Policy and as disclosed when you first submit your information or as permissible under applicable law",1.0,0.0,0.0,0.0
618,"  Use your information to provide services you've requested or provide you with offers, promotions (e.g., a sweepstakes, fantasy game, subscription to goods or services, etc.) or content or add you to our postal mail list;  ",0.0,0.0,1.0,0.0
619,"  Use your information to send you electronic communications, including emails about the league or a club applicable to your interactions with our Website, and about products, services, sponsors, partners and affiliates when you make a purchase, agree to rules or terms, or otherwise engage with our Website, to the extent the sending of such electronic communication is permissible under applicable law;  ",0.0,0.0,1.0,0.0
620,"  Use and share your information with one or more MLB Clubs or entities, to the extent that you've submitted information or accessed functionality or content that relates specifically to such Club(s) or entities (e.g., you've asked to receive the newsletter of a Club or you've purchased Club-specific merchandise), so they may learn more about fans like you, add you to the Club's postal mail list and provide better services to you;  ",0.0,0.0,1.0,0.0
621,you've submitted information,0.0,1.0,0.0,0.0
622,  Share your information upon notice posted on an applicable location of our Services where we collect your personal information for an economic transaction and notify you that we will be sharing such information with a third party;  ,0.0,0.0,1.0,0.0
623,  Use and share your information with our third-party survey partners to send you periodic surveys to help improve our Services or your MLB experience;  ,0.0,0.0,1.0,0.0
624,information,1.0,0.0,1.0,0.0
625,"  Use and share your information in connection with online loyalty, membership or rewards programs operated from our Services or with a third party from which you may receive goods or services in connection with such a program; or  ",0.0,0.0,1.0,0.0
626,  Use and share your information with permission from you.  ,0.0,0.0,1.0,0.0
627,solicit,0.0,1.0,0.0,0.0
628," Additional Information About Collection of Location Data    Location Data We Collect. When you use our Service we may solicit your permission to collect your location data. Please be advised, for some features within our Applications to function (e.g. live MLB game video) we must confirm your current location and therefore some features will not be available if you choose not to provide your location data to us. The specificity of the location data collected may depend on a number of factors, including the device you are using (e.g. laptop, smartphone, tablet) and how you are connected to the internet (e.g. via cable broadband connection, WiFi, etc.). If you enable location services for our Applications, we may collect location data (e.g. zip code) periodically as you use or leave open our Applications. We may also use this data internally or in conjunction with our third party service providers to customize your experience and provide offers that may be relevant to you. Depending on the platform you use to access our Applications (e.g., Apples iOS, Googles Android, Windows, etc.) you may be able to control from within the settings on your wireless device or the Application(s) whether location data is collected.  ",0.0,0.0,1.0,0.0
629,we may solicit your permission,0.0,1.0,0.0,0.0
630," Additional Information About Our Access to Your Contacts    Our Access to Your Contacts. When you use our Mobile Games, we may solicit your permission to access your contacts list (e.g., address book) so that we may match individuals from your contacts lists with those participating in our Mobile Games so you can invite your friends to play with and against you. We will not store the information in your contacts list.  ",0.0,0.0,1.0,0.0
631,we may solicit,0.0,1.0,0.0,0.0
632,as authorized by you,0.0,1.0,0.0,0.0
633,We use and permit automatic method,1.0,0.0,0.0,0.0
634," Other Information Collected And Shared Within Our Services.     Our Cookies and Web Beacons    We use and permit automatic methods such as cookies (small amounts of data which include a unique string of characters sent to your browser or application from a website's computers and stored on your computer's or device's hard drive), web beacons (technology used to track activity, also known as pixel tags) or similar technologies, alone or in combination with personally identifiable information you choose to provide us. Examples of the information we collect and analyze using such methods include, but is not limited to: personal information as authorized by you, the Internet protocol address used to connect your computer or device to the Internet; email address; login name and password; operating system type, version and computer or device platform; purchase history; the full Uniform Resource Locator clickstream to, on and from our Services, including date and time; and products you viewed or searched. We use software tools to measure and collect session information, including page response times, download errors, length of visits to certain pages, page interaction information (such as scrolling, clicks and mouse-overs) and methods used to browse away from a page. We use and may allow certain third parties, such as those who provide services associated with our Services, to access these automatic data collection methods to enable you to use a ""shopping cart"" while using our Services, to store your preferences and to improve, deliver and customize our Services' content and offerings.  ",0.0,0.0,1.0,0.0
635,as disclosed by you at the time you consent to the connection.,0.0,1.0,0.0,0.0
636," Device ID    When using our Mobile Games, we or our third party service provider may collect your unique device ID and share it on an aggregated and anonymous basis to help us understand our users and provide you a better experience. The aggregated and anonymous data may also be used by our third party service provider in connection with its products and services. If you wish to opt out of this anonymous data collection, please click here and follow the instructions.  ",0.0,0.0,1.0,0.0
637,collect your unique device ID and share it on an aggregated and anonymous basis,1.0,0.0,0.0,0.0
638," Disclosure for Legal Purposes.    We may be required to share your personal and non-personal information pursuant to judicial or governmental subpoenas, warrants or orders. If we are required to do so, we will, of course, obey the law. In addition, notwithstanding any term to the contrary in this Privacy Policy, we reserve the right to use, disclose or share your personal and non-personal information in order to investigate, prevent or take action regarding illegal activities, suspected fraud, situations involving potential threats to the safety of any person, violations of Terms of Use of any of our Services or as required by law.  ",0.0,0.0,1.0,0.0
639,"If you do not want information collected through the use of cookies, there is a simple procedure in most browsers that allows a user to accept or reject most cookies. Certain cookies that are set when some video products are accessed on our Website, called local shared objects or Flash cookies, may not be managed using the settings in your web browser. Information on managing, accepting and rejecting these cookies is available from Adobe on the Adobe website. If you set your browser or Adobe Flash options not to accept cookies or local shared objects, you may not be able to take advantage of certain Services.  ",0.0,0.0,1.0,0.0
640,require the submission,0.0,1.0,0.0,0.0
641," Special Rules For Children.    Because of federal law, we are not permitted to knowingly collect any personal information from a child under the age of thirteen without the consent of that child's parent or guardian. The statements in this Privacy Policy about our collection and use of personal information also apply to our treatment of personal information from children under the age of thirteen. Some elements of our Services (e.g., shop, ticketing, and auctions) require the submission of a payment card number along with personal information in connection with a purchase; other elements of our Services (e.g., fantasy baseball) require the submission of personal information to access or use the Services. Except in certain cases where limited contact information may be collected and not retained, these elements of our Services are not available to children under the age of thirteen. If a child who we know to be under the age of thirteen and for whom we have not received parental consent attempts to utilize a service on our Services which is not available to children, he/she will not be able to access it and may receive a message which relays that he/she is not eligible for such feature.  ",0.0,1.0,1.0,0.0
642,sign up,0.0,1.0,0.0,0.0
643," The Information We Collect and How We Use It    You may browse Food Allergy Research & Education websites without submitting personal information. However, if you choose to sign up for one of our e-mail lists; become a member; purchase products; or participate in an event, contest, or program, you will be asked for applicable personal data such as your name, gender, postal address, e-mail address, phone number, fax number, payment information, relationship to food allergies, and date of birth. The purpose of collecting such data is to assist FARE in contacting individuals and to collect payments made online. Food Allergy Research & Education also uses this personal information to advise users of new online materials, activities, and events, and to provide users with the opportunity to contribute to local and national programs and research initiatives.  ",0.0,0.0,0.0,1.0
644,you will be asked for,0.0,1.0,0.0,0.0
645,"Food Allergy Research & Education also collects personal information offline from volunteers, donors, and event participants. Such information may include name, address, telephone number, e-mail address, age, and information regarding the donation. The information is collected through offline registration forms, telemarketing appeals, and postal appeals. Food Allergy Research & Education uses this personal information to inform volunteers and donors of new materials, and activities and events that offer the opportunity to contribute to local and national programs and research initiatives.  ",0.0,0.0,0.0,1.0
646, Personal Health-Related Information    Personal information included in specific questions submitted to Food Allergy Research & Education is used solely as internal market research to help us better serve you. All other information entered on this site is used for aggregate demographic analysis only and no personally identifiable information is included in these analyses. Records are used to create aggregate reports for internal use only and are purged after one calendar year from the date of entry.  ,0.0,0.0,0.0,1.0
647,questions submitted,0.0,1.0,0.0,0.0
648,information entered,0.0,1.0,0.0,0.0
649,"Food Allergy Research & Education uses cookies to collect demographic data that help us better advertise our mission, programs, and events to potential visitors and to improve the functionality of the website and the experience for those who use our site. We receive data that includes the IP addresses, browser types, date/time stamp, donations, and sign-up information of visitors to our site.  ",0.0,0.0,0.0,1.0
650,uses cookies,1.0,0.0,0.0,0.0
651,"In addition, Food Allergy Research & Education uses cookies to allow us to track which other websites have linked visitors to our site, what pages of our site are used by and are of interest to those visitors, and to link to information those visitors provide to Food Allergy Research & Education when they donate or sign up to take part in our programs and events.  ",0.0,0.0,0.0,1.0
652,uses cookies to allow us to track,1.0,0.0,0.0,0.0
653,Cookies are used,1.0,0.0,0.0,0.0
654,Cookies are used in the site in order to remember the user's name. Sites containing other programs run by Food Allergy Research & Education may contain information as to how cookies are used on those sites.  ,0.0,0.0,0.0,1.0
655,"name, e-mail address, allergies, date of birth, gender, and postal address",0.0,1.0,0.0,0.0
656,we collect from users who visit and submit applications to our website,0.0,0.0,1.0,0.0
657,automatically collected anytime you visit an IFSA-Butler webpage,1.0,0.0,0.0,0.0
658,voluntarily supplied by visitors through the submission of inquiry forms or applications for programs offered through IFSA-Butler,0.0,1.0,0.0,0.0
659," Information We Collect   IFSA-Butler collects two types of information from visitors to this website:  non-personally identifiable information that is automatically collected anytime you visit an IFSA-Butler webpage, such as IP address, browser type, and referring websites and   information that is voluntarily supplied by visitors through the submission of inquiry forms or applications for programs offered through IFSA-Butler.  ",0.0,0.0,0.0,1.0
660,nformation that is voluntarily supplied by visitors,0.0,1.0,0.0,0.0
661,information that is automatically collected,1.0,0.0,0.0,0.0
662,information that is voluntarily supplied by visitors,0.0,1.0,0.0,0.0
663, How We Use Visitor Information    IFSA-Butler collects non-personally identifiable information with the purpose of optimizing the performance of our website.  ,0.0,0.0,1.0,1.0
664,"We do not rent or sell personally identifiable information to third-parties for their marketing purposes. We may share your information with select third parties in the following circumstances:   We share certain information with overseas institutions and service providers, including universities and host families, so that they may provide our students with the services we request of them.   We may share certain information about you, including but not limited to your name and home institution, for the purposes of promoting IFSA-Butler programs.   We reserve the right to disclose your information to law enforcement and government officials in accordance with applicable laws, court orders and government regulations.    ",0.0,0.0,0.0,1.0
665,when you provide information to IFSA-Butler through web forms and our application system.,0.0,1.0,0.0,0.0
666,when you provide information to IFSA-Butler through web forms and our application system,0.0,1.0,0.0,0.0
667,a user must first complete the registration form,0.0,1.0,0.0,0.0
668,for the user to provide,0.0,1.0,0.0,0.0
669,required to give,0.0,1.0,0.0,0.0
670,We request,0.0,1.0,0.0,0.0
671,A user must provide,0.0,1.0,0.0,0.0
672,we ask for,0.0,1.0,0.0,0.0
673,Participation in these surveys or contests is completely voluntary and the user therefore has a choice whether or not to disclose this information.,0.0,1.0,0.0,0.0
674,we ask them,0.0,1.0,0.0,0.0
675,"We're always working to make our services even better. One of the ways we do that is by analyzing information we collect and receive about users in order to figure out what they might be interested in. This helps us develop more engaging content and provide more effective advertising, which enables us to keep most of our services free.  ",0.0,0.0,0.0,1.0
676,collect and receive,0.0,0.0,1.0,0.0
677,Information We Collect and Receive   We collect and receive information about users in a few different ways:  ,0.0,0.0,0.0,1.0
678,You can give us information directly,0.0,1.0,0.0,0.0
679,You can give us information directly.,0.0,1.0,0.0,0.0
680,you sign up for,0.0,1.0,0.0,0.0
681,When you purchase,0.0,1.0,0.0,0.0
682,you can give us,0.0,1.0,0.0,0.0
683,When you post comments in response to a story or video,0.0,1.0,0.0,0.0
684,When you otherwise contact us or provide us information directly,0.0,1.0,0.0,0.0
685,We also collect or receive information when you use our Services.,1.0,0.0,0.0,0.0
686,"Information we collect or receive when you use our Services . We also collect or receive information when you use our Services. We collect some of this information using cookies, web beacons, and other technologies. Depending on how you access and use our Services, we may receive:  ",0.0,0.0,1.0,1.0
687,"using cookies, web beacons, and other technologies.",1.0,0.0,0.0,0.0
688,location-enabled services,1.0,0.0,0.0,0.0
689,"Location information . This information can include, for example, your device's GPS signal and information about nearby WiFi networks and cell towers. We get this information when you use location-enabled services like MapQuest, which can give you driving directions based on your current location.  ",0.0,0.0,0.0,1.0
690,when you use location-enabled services,1.0,0.0,0.0,0.0
691,about your use of,1.0,0.0,0.0,0.0
692,"Other information . Please note that AOL may use information about your use of certain AOL communication tools (for example, AOL Mail and AOL Instant Messenger); however, when you use AOL communication tools, AOL does not read your private online communications without your consent.  ",0.0,0.0,0.0,1.0
693,use information about your use,1.0,0.0,0.0,0.0
694,publicly or commercially available,1.0,0.0,0.0,0.0
695,"Information from third-party sources . We may receive additional information about you that is publicly or commercially available and combine that with the information we have collected or received about you in other ways. Also, we receive information about you when you choose to connect with social networking services while using our Services. Learn more about how that works here. Additionally, when you use AOL software (such as the AOL desktop software, AOL toolbars, or AIM), we may collect information about other software on your device for the limited purposes of providing the service you are using and improving the security of our services.  ",0.0,0.0,1.0,1.0
696,when you choose to connect,1.0,0.0,0.0,0.0
697,when you use AOL software,1.0,0.0,0.0,0.0
698,"To provide our Services. We use the information we collect and receive to provide you with the Services you use or request. For example:     If you request local movie show times from Moviefone, we might use your location information to provide you with times at nearby theaters;     If you sign up to receive the daily headlines from Huffington Post, we'll use your email address to deliver them to you; and     If you ask us to remember your login information for AOL Services, we'll use information stored in cookies when you return to those websites.  ",0.0,0.0,1.0,1.0
699,login information,0.0,1.0,0.0,0.0
700,"To improve our Services . We also use the information we collect and receive to provide content and advertising that people are likely to find relevant and engaging. For example:     If we notice that Huffington Post users in general prefer national political commentary, we might put that content in a special place on the website or in the app;     If we notice that a user is searching for sports cars on AOL Autos, we might show the user an ad for a sports car on AOL.com or on other sites in the AOL Advertising Network; and     If we receive information from users that a Service isn't working properly, we may use that information to address any problem.  ",0.0,0.0,1.0,1.0
