,Clause,Implicit,Explicit,Unspecified,not-selected
1820,"The personal information collected at these pages are used to identify you as a user of the site, to track your usage of interactive features, and to communicate with you regarding site news and updates. You can opt out of all newsletters, but you may still receive occasional notices regarding your specific usage of the site. We do not share this information with outside parties unless otherwise noted at the time of data entry.  ",0.0,0.0,1.0,0.0
1821,The personal information collected at these pages,0.0,0.0,1.0,0.0
1822,Illini Media uses non-identifying and aggregate information to better customize our websites for your use and to share general data about those who view our websites with our advertisers. We do not disclose anything that could be used to identify individuals.  ,0.0,0.0,1.0,0.0
1823,"Illini Media also uses Google Analytics that allows us to analyze data on our users' demographics (age, gender) and interests (affinity categories, other categories). Specifically, we are able analyze the this type of data:  ",0.0,0.0,1.0,0.0
1824,Demographics     Overview (overview of traffic by age and gender)    Age (traffic by age ranges)    Gender (traffic by gender)  ,0.0,0.0,1.0,0.0
1825,Interests     Overview (overview of traffic by affinity and other categories)    Affinity Categories (behavior by affinity categories)    In-Market Categories (behavior by in-market categories)    Other Categories (behavior by other interest categories)  ,0.0,0.0,1.0,0.0
1826,ories (behavior by other interest categories),0.0,0.0,1.0,0.0
1827,"Please note:     Illini Media uses Google Analytics.    Third-party vendors ads (including those served by Google) that appear on Illini Media's websites may appear across the Internet.    Illini Media and third-party vendors, including Google, use first-party cookies (such as the Google Analytics cookie) and third-party cookies (such as the DoubleClick cookie) together to inform, optimize, and serve ads based on someone's past visits to your website.    Illini Media and third-party vendors, including Google, use first-party cookies (such as the Google Analytics cookies) and third-party cookies (such as the DoubleClick cookie) together to report how our ad impressions, other uses of ad services, and interactions with these ad impressions and ad services are related to visits to your site.  ",0.0,0.0,1.0,0.0
1828,"we may initiate a program, service",0.0,0.0,1.0,0.0
1829,"When you use our digital or mobile application, certain information about your activity is collected. We use this information to determine our users' preferences, to design initiatives to meet those preferences, to eliminate hassles, and to generally make your TGI Fridays experience more satisfying. From time to time, we may initiate a program, service or survey that requests your name, birthday, email address, city of residence, ZIP code, or information about what you like and do not like about TGI Fridays. We recognize that the loyalty of our customers depends upon our relationships with them and we strongly support the rights of customers to maintain privacy of personal data. Don't worry, at TGI Fridays, your personal information is safe.  ",0.0,0.0,0.0,1.0
1830,"From time to time, we may initiate a program, service or survey",0.0,1.0,0.0,0.0
1831,"a program, service or survey that requests",0.0,1.0,0.0,0.0
1832,"We collect the domain name of visitors to our web pages, user-specific information on the pages visitors access,",0.0,0.0,1.0,0.0
1833," WHAT INFORMATION DO WE COLLECT?    We collect information in several different ways. We collect the domain name of visitors to our web pages, user-specific information on the pages visitors access, and information such as survey information or other information that you provide voluntarily. Like many other commercial websites, our website may employ a standard technology called a ""cookie"" to collect information about how our site is used. Our website provides a direct link (among others) to the TGI Fridays Give Me More Stripes Guest Recognition Program site ( www.givememorestripes.com) where, should you choose to enroll, you will be asked to submit personal information, which will be subject to the Give Me More Stripes terms and conditions, separate privacy policy and other policies. Our mobile application also allows enrollment in the Give Me More Stripes program by providing the same information. In addition, we may from time to time provide direct links to news or promotional sites featuring articles about TGI Fridays, which would be subject to those sites' policies.  ",0.0,0.0,0.0,1.0
1834,survey information or other information that you provide voluntarily.,0.0,1.0,0.0,0.0
1835,"where, should you choose to enroll, you will be asked to submit personal information,",0.0,1.0,0.0,0.0
1836,the pages visitors access,1.0,0.0,0.0,0.0
1837,"our website may employ a standard technology called a ""cookie""",1.0,0.0,0.0,0.0
1838,you will be asked,0.0,1.0,0.0,0.0
1839," HOW THE INFORMATION IS USED    We use the information that we collect to understand your preferences and history using our website, mobile application and related services. With this information we make it easier and more rewarding for you to use our website, mobile application, any related services, and enjoy your guest experience at our restaurants (in the case of voluntary surveys).  ",0.0,0.0,1.0,1.0
1840,voluntary surveys).,0.0,1.0,0.0,0.0
1841,"We will not transfer information to competitors. Your information will always be used only to help us ensure that our website, mobile application and any related services meet your expectations. At TGI Fridays, your personal information is safe. We don't sell or lend your information to anyone, and only share information with the parties described above.  ",0.0,0.0,1.0,0.0
1842,", you may be asked whether you'd like to receive notifications via text message. If you agree to those communications",0.0,1.0,0.0,0.0
1843,The Personally Identifying Information (PIN) gathered by MediaNews on MediaNews Web sites,0.0,0.0,1.0,0.0
1844,"INFORMATION COLLECTED   Personally Identifying Information (PIN)   The Personally Identifying Information (PIN) gathered by MediaNews on MediaNews Web sites generally includes, e-mail address, password, zip code, age, gender and whether you are a print subscriber, but may also include your name (and/or company name), street address, and date of birth, phone numbers, and credit card numbers or other billing information where necessary to contact you or to process your Web site purchases. MediaNews may also collect information such as household income, job title, personal interests and hobbies. The PIN collected depends on the page you are visiting and the services that you participate in.  ",0.0,0.0,0.0,1.0
1845,"Upon registration, we require you provide",0.0,1.0,0.0,0.0
1846,"Web Site Sites Products: Your PIN as well as a telephone number, credit card number or other billing information is generally collected in order to process the purchase of services or products on the MediaNews Web sites,",0.0,0.0,1.0,0.0
1847,"Web Site Sites Products: Your PIN as well as a telephone number, credit card number or other billing information is generally collected in order to process the purchase of services or products on the MediaNews Web sites, such as purchasing a newspaper subscription or placing an ad. Your PIN will also be collected upon registration for home delivery requests, vacation delivery stop requests and other similar requests as well as upon the use or download of software available on MediaNews Web sites.  ",0.0,0.0,0.0,1.0
1848,request additional PIN from you,0.0,1.0,0.0,0.0
1849,MediaNews may request additional PIN from you,0.0,1.0,0.0,0.0
1850,that choose to provide,0.0,1.0,0.0,0.0
1851,choose to provide,0.0,1.0,0.0,0.0
1852,"If such information is gathered for a MediaNews survey, no PIN is released and is reported or used only in aggregate form.  ",0.0,0.0,1.0,1.0
1853,"Special Circumstances: MediaNews may disclose and use the information collected where required to do so by law, or where MediaNews, in good faith, believes the use or disclosure of the information collected is necessary to (1) comply with the law or legal processes; (2) protect and defend MediaNews rights and property; (3) protect against misuse or unauthorized use of any MediaNews Web site; or to (4) protect the personal safety or property of our users or the public. MediaNews may also use the information collected when, in its sole discretion, it believes necessary or appropriate in connection with a sale or transfer of some or all of MediaNews' assets in our Web site.  ",0.0,0.0,1.0,0.0
1854,"Cookies and Web Beacons: Cookies are used to store and track information about you. A cookie is a small amount of data that is sent to your browser from Web sites and stored on your computer's hard drive. Cookies are used to deliver targeted advertising based on your behavior and demographics and to track your entries in promotions and contests. Cookies may be linked to PIN. In addition, MediaNews uses web beacons provided by third-party advertising companies to help manage our online advertising. Web beacons enable us to recognize a browser's cookie when a browser visits a MediaNews Web site, and to learn which banner ads bring users to MediaNews Web sites. MediaNews websites have two third-party web advertising companies, Yahoo! and DoubleClick, which may place or recognize a unique cookie on your browser. Yahoo! also may use information regarding its own users to select which ads to display. Click here to learn more about Yahoo!'s ad practices, including how to opt out of using anonymous information to select which ads to show you. For more information about DoubleClick, cookies, and how to ""opt-out"", please click here.  ",0.0,0.0,0.0,1.0
1855,A cookie is a small amount of data that is sent to your browser from Web sites and stored on your computer's hard drive.,1.0,0.0,0.0,0.0
1856,Internet Protocol (IP) Address: An IP address is your computer's location on the Internet. MediaNews Web sites log IP addresses,1.0,0.0,0.0,0.0
1857,"Internet Protocol (IP) Address: An IP address is your computer's location on the Internet. MediaNews Web sites log IP addresses for systems administration and trouble shooting purposes, to gather demographic and other information about you and to link information about a user's computer session to PIN.  ",0.0,0.0,0.0,1.0
1858,"Aggregate information: Aggregate information is user information not linked to PIN.   USE OF INFORMATION COLLECTED   In general, MediaNews uses your PIN and CIN that is collected to administer the MediaNews Web sites and to provide services you request. When you provide PIN information and access MediaNews Web sites, you are sharing PIN and CIN with MediaNews and MediaNews Group affiliates and MediaNews reserves the right to use and disclose the PIN and CIN it collects. If you do not want to share your PIN, do not provide it. If you do not want to share CIN, do not access MediaNews Web sites. In addition, MediaNews may share PIN, CIN and/or aggregate information with third parties such as advertisers and business partners. PIN and CIN may also be used to perform statistical, demographic and marketing analysis of subscribers and their subscribing and purchasing patterns, to target advertisements and to help diagnose problems with our services and our Web sites.  ",0.0,0.0,1.0,1.0
1859,that is collected,0.0,0.0,1.0,0.0
1860,"For example, MediaNews uses or may use the PIN and CIN collected to do the following:   Web Site Use Registration: MediaNews uses PIN and CIN that is collected to fulfill subscriptions, change addresses, suspend delivery, confirm and process transactions and to contact the user regarding his or her account, new or existing products and services and special offers.  ",0.0,0.0,1.0,1.0
1861,"Personalization: MediaNews uses PIN and CIN that is collected to personalize the content and advertising that users see based on personal characteristics and preferences, enhance products and services and develop new products and services, and share user information with select advertisers or other third parties whose products or services may be of interest to you.  ",0.0,0.0,1.0,1.0
1862,Program Product Offerings: MediaNews may use the PIN and CIN that is collected in order to offer you the opportunity to receive information and offers about products or services from our business partners or third parties.  ,0.0,0.0,1.0,1.0
1863,we may request,0.0,1.0,0.0,0.0
1864,"Information is collected actively,",0.0,1.0,0.0,0.0
1865,"For each visitor to our Web site, or Web server automatically recognizes only the consumer's domain name, operating system, and web browser version but not the e-mail address. Cookies are generated and placed on your computer when you visit a Web site. They make your return visits to a Web site more convenient. We do not use cookies to collect personal information, and we do not use cookies to retrieve information from your computer for purposes that are unrelated to the Web site or your interaction with the Web site.  ",0.0,0.0,0.0,1.0
1866,when you visit a Web site.,1.0,0.0,0.0,0.0
1867,Cookies are generated and placed on your computer when you visit a Web site.,1.0,0.0,0.0,0.0
1868,you choose to provide,0.0,1.0,0.0,0.0
1869,Some information may be collected automatically,1.0,0.0,0.0,0.0
1870," What Information Do We Collect-    Meredith and our service providers collect a variety of information about you including:     Information you choose to provide to us directly when using our Services and information about the computers and devices you use to access our services, including their location.    Information about your browsing activity as you use our Services and interact with our content, email messages and advertising. Some information may be collected automatically through cookies, beacons and other tracking and personalization technologies.    Information about you or your household that we obtain from other sources where permitted by law.  ",0.0,0.0,1.0,1.0
1871,you choose to provide to us directly,0.0,1.0,0.0,0.0
1872,browsing activity,1.0,0.0,0.0,0.0
1873, How We Use the Information We Collect      We and our service providers use the information about you we collect for a variety purposes including to:    Customize the content and advertising you see and recognize you as a previous visitor.    Provide the services you request and improve these services.    Tell you about offers we think you will value.    Conduct market research and audience analysis    For any other purpose described at the point of collection or with your consent.  ,0.0,0.0,1.0,1.0
1874,with your consent.,0.0,1.0,0.0,0.0
1875,you voluntarily,0.0,1.0,0.0,0.0
1876,voluntarily supply,0.0,1.0,0.0,0.0
1877,information collected automatically,1.0,0.0,0.0,0.0
1878,you voluntarily supply to us,0.0,1.0,0.0,0.0
1879," Information Collected Through Our Services:    The information we gather through our Services falls into two categories: (1) information you voluntarily supply to us when you register, initiate transactions, participate in promotions or surveys, submit comments or questions or otherwise communicate with us or others through the Services, and (2) information collected automatically as you use our Services. Third-party providers and advertisers featured on, or linked to or from, our Services may also gather information through processes that we don't control and subject to their own separate privacy policies, which may differ from ours. Some of our Services also may participate in third-party advertising networks that collect information about your activity online to tailor some of the advertising that you see on sites in their networks to your interests.  ",0.0,0.0,1.0,0.0
1880,When you register,0.0,1.0,0.0,0.0
1881," Registration and Other Personally Identifying Information.    You may register to use certain features of our Services. When you register, we may collect personally identifying information, including your name, postal address, email address, user name and password, reminder questions and answers and communications preferences, such as which newsletters you would like to receive. We may also ask for information about your age, gender, hobbies, interests, preferences (such as your favorite foods, purchases or recipes) and the like, but you're free to register for most of our Services without providing this additional information. When you register for one of our Services, the information you provide may be added to a centralized Meredith database so that you may be simultaneously registered for our other Services as well. In addition, when you use various aspects of our Services, we may ask you for personally identifying information, including when you order products, complete a survey, enter a contest, or report a problem with our Services. We may also collect contact information for other individuals when you use the sharing and referral tools available within some of our Services to forward content or offers to your friends and associates. We use this information to facilitate the communications that you request. Please note that if you use any ""send-to-a-friend"" features of our Services, your email address may be included in the communication sent to your friend.  ",0.0,0.0,1.0,1.0
1882,register,0.0,1.0,0.0,0.0
1883,when you use the sharing and referral tools,0.0,0.0,1.0,0.0
1884," Contests and Other Promotions.    From time to time, we may offer contests, sweepstakes or other promotions. Participation in these promotions may require registration for our Services (see ""Registration and Other Personally Identifying Information,"" above). We may also automatically enter our users in some promotions. If you choose to participate in promotions that require registration, we will collect contact information such as your name, address, and email address and we may share this information with co-sponsors or other third parties involved in the promotion that we identify in the rules or entry materials. We don't control these third parties' privacy practices, and our Privacy Policy does not apply to their collection and use of your information. We may also share some of your entry information with third parties or the public in connection with the administration of the promotion, such as winner selection and prize fulfillment, and as permitted by the promotion's official rules, such as on a winners' list.  ",0.0,0.0,0.0,1.0
1885,registration,0.0,1.0,0.0,0.0
1886,while navigating,1.0,0.0,0.0,0.0
1887,"  Web pages, content and advertisements you view and links you click on while navigating within our Services;  ",0.0,0.0,0.0,1.0
1888,view and links you click on,1.0,0.0,0.0,0.0
1889,"  Information about your interactions with our video or audio content, such as the type of content accessed via our Services;  ",0.0,0.0,1.0,1.0
1890,"  Information about your interactions with our email messages, such as the links you click on and whether you open or forward a message, the date and time of these interactions and the device you use to read emails;  ",0.0,0.0,1.0,1.0
1891,The site you visited before visiting a Meredith website and the site you visited after visiting a Meredith website,1.0,0.0,0.0,0.0
1892,  The site you visited before visiting a Meredith website and the site you visited after visiting a Meredith website;  ,0.0,0.0,0.0,1.0
1893,  Your Internet Protocol (IP) address (a numerical address assigned to your computer by your Internet service provider so that other computers connected to the Internet can communicate with you online) that can sometimes be used to derive your general geographic area;  ,0.0,0.0,0.0,1.0
1894,Search terms you enter,1.0,0.0,0.0,0.0
1895,  Search terms you enter using our Services or on a referral site;  ,0.0,0.0,0.0,1.0
1896,terms you enter,0.0,1.0,0.0,0.0
1897,"mobile device identification numbers, that can identify the physical location of devices in accordance with applicable law;",1.0,0.0,0.0,0.0
1898,"  Unique identifiers, including mobile device identification numbers, that can identify the physical location of devices in accordance with applicable law;  ",0.0,0.0,1.0,1.0
1899,"  Your device type, screen size, browser type, language, plug-ins, Internet domain, TCP configuration parameters, operating system and versions of installed software;  ",0.0,0.0,0.0,1.0
1900,"Your device type, screen size, browser type, language, plug-ins, Internet domain, TCP configuration parameters, operating system and versions of installed software;",1.0,0.0,0.0,0.0
1901,server log information,1.0,0.0,0.0,0.0
1902,  standard server log information; and  ,0.0,0.0,0.0,1.0
1903,"  Information collected through cookies, web beacons and other tracking technologies (see additional descriptions of these terms below).  ",0.0,0.0,0.0,1.0
1904,"collected through cookies, web beacons and other tracking technologies (see additional descriptions of these terms below).",1.0,0.0,0.0,0.0
1905,embedded,1.0,0.0,0.0,0.0
1906," Personalization and Tracking Technologies.    Like most website and mobile application operators, we, or third parties acting on our behalf, use embedded scripts, ""cookies,"" web beacons and other tracking technologies to operate, analyze and improve our Services and tailor content and advertising to user interests. Third-party companies that provide some of the tools and features accessible through our Services and advertisers and other companies involved in the delivery of advertisements you see on our Services and other websites also may use tracking technologies to collect information about your use of our Services. Cookies. Cookies are small amounts of data (often containing a unique identifier) that are stored in separate files within your computer or device's Internet browser. Cookies are accessed and recorded by the websites you visit, and by the companies that deliver the advertisements you see on our services, so they can recognize the same browser navigating online. You can set your browser to accept or reject most cookies, or to notify you when a cookie is set. (Each browser is different, so check the ""Help"" menu of your browser to learn how to change your cookie preferences.) It is up to you to decide whether to allow us or third parties to set cookies, but if you block cookies, you may not be able to view or access some of the features of our Services. Please be aware that certain browsers cannot block or delete so-called ""Flash"" cookies, which use a feature of the Adobe Flash video player to store information on your computer. For information about how to delete Flash cookies, please visit the Adobe website here.  ",0.0,0.0,0.0,1.0
1907,"embedded scripts, ""cookies,"" web beacons and other tracking technologies",1.0,0.0,0.0,0.0
1908,When you use mobile devices to access our Services,1.0,0.0,0.0,0.0
1909," Mobile Device IDs and Location-Based Information.    Certain mobile devices, including smart phones and tablet devices, contain unique device IDs that can be used to identify their physical location. Mobile devices also typically transmit caller ID data (which may include a phone number) when used to transmit a telephone call or text message. When you use mobile devices to access our Services, we may collect and transmit unique device IDs and collect caller ID data, information about your wireless carrier, the make, model, operating system and settings of your device and information about how you navigate within our Service. With your consent, we also may use precise geolocation technology such as GPS or Wi-Fi triangulation to collect information about the exact location of your mobile device.  ",0.0,0.0,0.0,1.0
1910," Information We May Obtain From Other Sources:    We may combine any information collected through the Services with other information that we obtain about you, your computer, and/or device from other companies and sources, including third-party data suppliers and public databases. The following are examples of information we may collect from other sources:     Name, postal address, email address and telephone number;    Demographic data, such as age, gender, and income level;    Your interests and purchase behavior;    Publicly-visible data, such as your posts and submissions to blogs, video-sharing services, and other interactive forums; and    Other navigation data, such as web sites visited and advertisements viewed or clicked on.  ",0.0,0.0,1.0,1.0
1911,payment and identity verification information,0.0,1.0,0.0,0.0
1912," How We Use The Information We Collect:    Our primary goal in collecting information is to provide you with a customized experience when using our Services and to make them more valuable to you. Because our Services are supported by advertising, we also use the information we collect to help us and advertisers efficiently reach consumers who are most likely to be interested in particular products and services. We only use payment and identity verification information as necessary to complete a particular transaction, provide a requested service, enforce legal rights or comply with applicable law.  ",0.0,0.0,1.0,1.0
1913,"In addition, we and our authorized service providers generally use other information that we or they collect about you to:  ",0.0,0.0,1.0,1.0
1914,  Customize the content you see when you use our Services and other services as you navigate online;  ,0.0,0.0,0.0,1.0
1915,as you navigate online,1.0,0.0,0.0,0.0
1916,"  Analyze, operate and improve our Services, and fulfill your requests for products, services, and information, including to send you email and electronic newsletters;  ",0.0,0.0,1.0,1.0
