,Clause,Implicit,Explicit,Unspecified,not-selected
1206,"Additionally, we may also collect other types of information (known as demographic information) such as your gender, hobbies, occupation, platform preferences, and other game ownership information. This demographic information may be associated with your personal information.  ",0.0,0.0,1.0,0.0
1207," How We Use Your Personal Information    The personal information you provide to us will allow us to fulfill your product or service order; alert you of new products or services, features, or enhancements; handle/route your customer service questions or issues; and/or notify you of upgrade opportunities, contests, promotions, or special events and offers. We also use your e-mail address to send you messages about the Curse Features and other general announcements. We keep track of your interactions with us, including but not limited to your activity within the Curse Features. We may use personal information that you provide to us to send messages to you in response to your request to perform an activity in connection with your use of any of the Curse Features. We may also use your personal information to contact you when necessary.  ",0.0,0.0,1.0,0.0
1208,The personal information you provide to us,0.0,1.0,0.0,0.0
1209,You may not realize this information is being collected.,1.0,0.0,0.0,0.0
1210,"Like many websites, we employ cookies in certain areas of the Site(s) to allow us to provide information which is targeted to your interests and to make your online experience more convenient. For example, when you return to one of our websites after logging in, cookies provide information to the website so that the website will remember who you are. Should you disable cookies in your browser",1.0,0.0,0.0,0.0
1211,"In some cases, we may have access to information from cookies used by these advertisers on the Site(s) and this information may permit us to identify other sites that you have visited that are also associated such advertisers.",1.0,0.0,0.0,0.0
1212," Cookies    ""Cookies"" are small bits of electronic information that a website sends to a visitor's browser and are stored on the visitor's hard drive. Like many websites, we employ cookies in certain areas of the Site(s) to allow us to provide information which is targeted to your interests and to make your online experience more convenient. For example, when you return to one of our websites after logging in, cookies provide information to the website so that the website will remember who you are. Should you disable cookies in your browser, you will have to provide your screen name and password each time you log in. Additionally, advertisements that are managed by third parties which may appear on the Site(s) use cookies. Advertisers use cookies to collect non-personal information when you click on or move your cursor over one of their banner advertisements. You may not realize this information is being collected. Advertisers use this information to monitor the performance of their advertisements. In some cases, we may have access to information from cookies used by these advertisers on the Site(s) and this information may permit us to identify other sites that you have visited that are also associated such advertisers.  ",0.0,0.0,1.0,0.0
1213,"Our servers automatically record information that your browser sends whenever you visit the Site(s). Additionally, some of the Curse Features may collect information regarding your computer system. This information includes your Internet Protocol address, your browser type and version, the search engine you used to find the Curse Features, if any, the operating system your computer uses, the type of computer hardware you have (such as the amount of RAM, the type of GPU or type of CPU in your computer) which Curse Features you use and when and how long you use them. We use this information to monitor and analyze how users use the Curse Features, to provide customer service and to maintain and improve the Curse Features.",1.0,0.0,0.0,0.0
1214,utomatically,1.0,0.0,0.0,0.0
1215," Children's Privacy    We do not knowingly collect personal information from children under 13. We take children's privacy seriously, and encourage parents to play an active role in their children's online experience at all times.  ",0.0,0.0,1.0,0.0
1216,nformation that you provide by filling in forms on our site,0.0,1.0,0.0,0.0
1217,information that you provide by filling in forms,0.0,1.0,0.0,0.0
1218,that you provide by filling in forms on our site,0.0,1.0,0.0,0.0
1219,if you contact us,0.0,1.0,0.0,0.0
1220,details of your visits to our site,1.0,0.0,0.0,0.0
1221,"A cookie is a small amount of data, which often includes a unique identifier that is sent to your computer or mobile phone browser from a websites computer and is stored on your devices hard drive. A website can send its own cookie to your browser if your browsers preferences allow it, but your browser only permits a website to access the cookies it has already sent to you, not the cookies sent to you by other websites. Many websites do this whenever a user visits their website in order to track online traffic flows.",1.0,0.0,0.0,0.0
1222,"During the course of any visit to the Sci-News.com website, the pages you see, along with a cookie, are downloaded to your device.",1.0,0.0,0.0,0.0
1223,you knowingly choose to disclose,0.0,1.0,0.0,0.0
1224,as you interact with our website.,1.0,0.0,0.0,0.0
1225,and website use information collected by us as you interact with our website,1.0,0.0,0.0,0.0
1226,collected by us as you interact with our website.,1.0,0.0,0.0,0.0
1227,We also gather or may gather certain information about your use of our site,1.0,0.0,0.0,0.0
1228,"Moreover, there is information about your computer hardware and software that we collect or may collect.",1.0,0.0,0.0,0.0
1229,We may use your contact information,0.0,1.0,0.0,0.0
1230,you have expressed),0.0,1.0,0.0,0.0
1231,A cookie is a text file that is placed on your hard drive by a web page server.,1.0,0.0,0.0,0.0
1232,"Web beacons collect only a limited set of information including a cookie number, time and date of a page view, and a description of the page on which the web beacon resides.",1.0,0.0,0.0,0.0
1233,participants provide this information on a voluntary basis only.,0.0,1.0,0.0,0.0
1234,Passive Information,1.0,0.0,0.0,0.0
1235,Passive,1.0,0.0,0.0,0.0
1236,Passive Information Collection,1.0,0.0,0.0,0.0
1237,log information,1.0,0.0,0.0,0.0
1238,"""Log files"" are files that log actions that have occurred on a website",1.0,0.0,0.0,0.0
1239,tracking purposes,1.0,0.0,0.0,0.0
1240,SNEA shares its Sony Entertainment Network account holders' information with us,1.0,0.0,0.0,0.0
1241,Consumers who voluntarily provide,0.0,1.0,0.0,0.0
1242,"having information regarding their activities added to their customer profile, whether information regarding those activities comes from SCEA internal sources, So",0.0,0.0,1.0,0.0
1243,We may give Sony Entertainment Network account holders the opportunity to provide information about themselves,0.0,1.0,0.0,0.0
1244,dynamic in-game advertising,1.0,0.0,0.0,0.0
1245,"Email addresses collected from consumers during the use of the E-Cards or ""Send-to-a-Friend"" email feature on our websites",0.0,1.0,0.0,0.0
1246,SCEA's consumer services department maintains information obtained from consumers who contact or submit,0.0,1.0,0.0,0.0
1247,who contact or submit an online complaint,0.0,1.0,0.0,0.0
1248,allows job seekers to inquire about jobs and submit personally identifying information in connection with applying for employment.,0.0,1.0,0.0,0.0
1249,asked to provide,0.0,1.0,0.0,0.0
1250,"We are lynda.com, Inc., located at 6410 Via Real, Carpinteria, CA 93013, USA. We are committed to protecting and respecting your privacy. This Privacy Policy describes the types of information we may collect from you or that you may provide to us when you visit the lynda.com websites located at www.lynda.com, m.lynda.com and www.video2brain.com (the Websites) or the lynda.com mobile application (App) (collectively, the Services) , and our practices for collecting, using, maintaining, protecting and disclosing such information. This Privacy Policy applies to information we collect: (i) through our Services, (ii) in text and electronic messages between you and our Services, and (iii) via mobile applications you download from our Websites, which provide dedicated non-browser-based interactions between you and our Services. This Privacy Policy does not apply to any information collected by us offline or via third-party sites that may be accessed through hyperlinks on our Services.  ",0.0,0.0,0.0,1.0
1251,that you may provide,0.0,1.0,0.0,0.0
1252,"Please read the information below:   Information we collect about you     Where we store data     How we use your information     Disclosure of your information     Updating or correcting your personally identifiable information     Canceling your account or deleting your personally identifiable information     Choices regarding control of your personally identifiable information     Information related to data collected through the lynda.com platform service     Data Security     Cookies     Mobile Analytics     Links to third party web sites and advertisers     Notice to California residents     Changes to this Privacy Policy     Communities, forums, chat rooms, and message boards     Social Media features     Gift Certificates     How do you contact us with questions?  ",0.0,0.0,0.0,1.0
1253,1. INFORMATION WE COLLECT ABOUT YOU   We collect several types of information about visitors and/or users of our Services. We may collect this information either directly when you provide it to us or automatically as you navigate through the Websites or App.  ,0.0,0.0,0.0,1.0
1254,automatically as you navigate through the Websites or App,1.0,0.0,0.0,0.0
1255,directly when you provide it to us,0.0,1.0,0.0,0.0
1256,automatically as you navigate,1.0,0.0,0.0,0.0
1257,either directly when you provide,0.0,1.0,0.0,0.0
1258,"you register for a Service/create an account, subscribe to a newsletter, submit feedback, enter a contest, fill out a survey, or send us a communication",0.0,1.0,0.0,0.0
1259,"(a) Personally Identifiable Information. Personally Identifiable Information refers to information by which you may be personally identified, such as your name, email address, or school. We will collect and process such data about you when you register for a Service/create an account, subscribe to a newsletter, submit feedback, enter a contest, fill out a survey, or send us a communication. When ordering products or services on the Websites or App, you may also be asked to provide a credit card number and other payment-related information. You may also provide information to be published or displayed (posted) on public areas of the Websites (such as blogs, forums, message boards, and the like), or transmitted to other users of the Websites using sharing features (collectively, User Contributions) . Your User Contributions are posted and transmitted to others at your own risk. We cannot control the actions of other users of the Websites with whom you may choose to share your User Contributions. Depending upon the activity, some of the information we ask you to provide is identified as mandatory and some as voluntary. If you do not provide the mandatory data with respect to a particular activity, you will not be able to engage in that activity.  ",0.0,0.0,0.0,1.0
1260,may also provide,0.0,1.0,0.0,0.0
1261,we ask you to provide,0.0,1.0,0.0,0.0
1262,provide t,0.0,1.0,0.0,0.0
1263,collect your Internet Protocol (IP) address,1.0,0.0,0.0,0.0
1264,"We may also collect your Internet Protocol (IP) address. We use your IP address to diagnose problems with our servers, software, to administer our Services and to gather demographic information.  ",0.0,0.0,0.0,1.0
1265,"We do not collect more Personally Identifiable Information than is reasonably necessary to participate in an activity on the Websites. If you are a school and you use a lynda.com service within the United States for children under the age of 13, you are responsible for obtaining consent from the parents/legal guardians of each child you wish to allow to participate in using any of our Services. A child using our Services will be able to participate in certain activities such as taking online educational and informational courses.  ",0.0,0.0,0.0,1.0
1266,"(b) Non-Personally Identifiable Information. We may collect, or our third party ad server and/or content server may collect, certain Non-Personally Identifiable Information, that does not by itself identify a specific individual. Such information tells us about your equipment, browsing actions, the resources that you access and use through the Services, your operating system and browser type. Our third party ad servers will provide us with summary, but not individual, reports that will tell us how many ads were presented and clicked upon at our Websites. The information that we collect automatically is statistical in nature. It helps us to deliver a better and more personalized service to users, by enabling us to estimate usage patterns, customize our Services according to your individual preferences, and speed up your searches.  ",0.0,0.0,0.0,1.0
1267,The information that we collect automatically is statistical in nature,1.0,0.0,0.0,0.0
1268,"(c) Device Information. When you download our App and use our Services, we automatically collect information on the type of device you use and the operating system version, so we know the best application version to provide you with. We do not ask you for, access or track any location based information from your mobile device at any time while downloading or using our App or Services.  ",0.0,0.0,0.0,1.0
1269,"2. WHERE WE STORE DATA   The data that we collect from you may be transferred to, and stored at, a destination outside the European Economic Area (EEA) . It may also be processed by staff operating outside the EEA who work for us or for one of our service providers. Such staff maybe engaged in, among other things, the fulfilment of your order, the processing of your payment details and the provision of support services. By submitting your personal data, you agree to this transfer, storing or processing. lynda.com will take all steps reasonably necessary to ensure that your data is treated securely and in accordance with this Privacy Policy.   3. HOW WE USE YOUR INFORMATION   We use information held about you in the following ways:  ",0.0,0.0,0.0,1.0
1270,  To ensure that content from our Services is presented in the most effective manner for you and for your computer or mobile device  ,0.0,0.0,1.0,1.0
1271,"  To provide you with information, products or services that you request from us or which we feel may interest you, where you have consented to be contacted for such purposes  ",0.0,0.0,0.0,1.0
1272,that you request from us,0.0,1.0,0.0,0.0
1273,we feel may interest you,1.0,0.0,0.0,0.0
1274,"any contracts entered into between you and us, including for billing and collection",0.0,0.0,1.0,0.0
1275,"  To carry out our obligations arising from any contracts entered into between you and us, including for billing and collection  ",0.0,0.0,0.0,1.0
1276,"  If you pay for Services using a credit card, we will transmit your credit card data to the appropriate credit card company and/or credit card payment processing company  ",0.0,0.0,0.0,1.0
1277,"To allow you to participate in interactive features of our Services, when you choose to do so",0.0,0.0,1.0,0.0
1278,"  To allow you to participate in interactive features of our Services, when you choose to do so  ",0.0,0.0,0.0,1.0
1279,To notify you about changes to our Services,0.0,0.0,1.0,0.0
1280,  In any other way we may describe when you provide the information  ,0.0,0.0,0.0,1.0
1281,when you provide,0.0,1.0,0.0,0.0
1282,"If you are an existing customer, we will only contact you by electronic means (e-mail or SMS) with information about goods and services similar to those which were the subject of a previous sale to you.  ",0.0,0.0,0.0,1.0
1283,"If you use the Contact Us form on our site, we will respond to your inquiry and delete the information provided after your request has been fulfilled.  ",0.0,0.0,0.0,1.0
1284,"We will retain your or your childs information for as long as your account is active or as needed to provide you Services. If you wish to cancel your or your childs account or request that we no longer use your information to provide you Services contact us at support@lynda.com. We will retain and use your information as necessary to comply with our legal obligations, resolve disputes, and enforce our agreements. We will respond to your request to access within 30 days.  ",0.0,0.0,0.0,1.0
1285,indicated upon registration,0.0,1.0,0.0,0.0
1286,If you indicated,0.0,1.0,0.0,0.0
1287,"If you indicated upon registration that you are interested in receiving offers or information from us and our partners, we may occasionally send you direct mail about products and services that we feel may be of interest to you. Only lynda.com (or agents working on behalf of us and under confidentiality agreements) will send you these direct mailings, and only if you did not later opt-out of such offers.  ",0.0,0.0,0.0,1.0
1288,"We do not send unsolicited commercial e-mails. We offer commercial e-mail recipients the opportunity to opt-out of further communications in every e-mail. Please note that we may not include the opt-out information in non-commercial Service e-mails (i.e., e-mails concerning your order, the Website Terms of Service, etc.).  ",0.0,0.0,0.0,1.0
1289,"You also have choices with respect to cookies, as described below. By modifying your browser preferences, you have the choice to accept all cookies, to be notified when a cookie is set, or to reject all cookies. If you choose to reject all cookies some parts of our Websites may not work properly in your case.  ",0.0,0.0,0.0,1.0
1290,"8. INFORMATION RELATED TO DATA COLLECTED THROUGH THE LYNDA.COM PLATFORM SERVICE   For certain services lynda.com collects information under the direction of its clients (e.g., an entity that subscribes to the Services for use by the entitys personnel). In this respect, lynda.com acts as a data processor and has no direct relationship with the individuals whose Personally Identifiable Information it processes. An individual who seeks access, or who seeks to correct, amend, or delete inaccurate data should direct his or her query to the relevant lynda.com client (the data controller). If the client makes a request to us to remove the data, we will respond to their request within 30 days.  ",0.0,0.0,0.0,1.0
1291,To the extent we have,0.0,0.0,1.0,0.0
1292,use our,1.0,0.0,0.0,0.0
1293,10. COOKIES AND OTHER TECHNOLOGIES   When you use our Websites we may use cookies and other technologies in order to facilitate and customize your use of our Services.  ,0.0,0.0,0.0,1.0
1294,"Our cookies store randomly assigned user identification numbers, the country where you are located, and your first name to welcome you back to our Websites. The cookies make your use of the Websites easier, make the Websites run more smoothly, and save your logged-in state so that you do not have to log in each time that you visit the Websites.  ",0.0,0.0,0.0,1.0
1295,Our cookies store,1.0,0.0,0.0,0.0
1296,"The use of cookies by our partners, affiliates, tracking utility company and service providers, is not covered by our Privacy Policy. We do not have access or control over these cookies. Our partners, affiliates, tracking utility company, and service providers, use session ID cookies to make it easier for you to navigate our site, in order for you to use the shopping cart, etc.  ",0.0,0.0,0.0,1.0
1297,"You can disable and/or delete all types of cookies by using your browser settings. Cookies are generally easy to disable and/or delete but how you do so varies from browser to browser. The help function within your browser should tell you how to do it. The best way may be to close your browser and then search for cookie folder or cookie manager or simply cookie. Please also visit www.allaboutcookies.org for more information about cookies and how to disable them. If you do disable cookies, our Websites will not recognize you and you may not have access to all portions of the Websites.  ",0.0,0.0,0.0,1.0
1298,"What are clear gifs? Clear gifs are tiny graphics with a unique identifier, similar in function to cookies, and are used to track the online movements of Web users. In contrast to cookies, which are stored on a users computer hard drive, clear gifs are embedded invisibly on Web pages and are about the size of the full-stop or period at the end of this sentence.  ",0.0,0.0,0.0,1.0
1299,store,1.0,0.0,0.0,0.0
1300,"What is a Flash cookie? Local storage objects, also known as Flash cookies, are similar in function to browser cookies in that they store some information about you or your activities on our Websites. We use Flash cookies in certain situations where we use Flash to provide some content such as video clips or animation. The options within your browser may not prevent the setting of Flash cookies. To manage Flash cookies please click here: http://www.macromedia.com/support/documentation/en/flashplayer/help/settings_manager07.html.  ",0.0,0.0,0.0,1.0
1301,mobile analytics software,1.0,0.0,0.0,0.0
1302,"11. MOBILE ANALYTICS   We use mobile analytics software to allow us to better understand the functionality of our mobile software on your phone. This software may record information such as how often you use the App, the events that occur within the App, aggregated usage, performance data, and where the App was downloaded from. We do not link the information we store within the analytics software to any Personally Identifiable Information you submit within the App.  ",0.0,0.0,0.0,1.0
1303,nd have provided us,0.0,1.0,0.0,0.0
1304,If you or your child choose to disclose,0.0,1.0,0.0,0.0
1305,collect your,1.0,0.0,0.0,0.0
1306,we will ask you for the individuals name and email address,0.0,1.0,0.0,0.0
1307,"UpToDate online privacy policy   UpToDate, Inc. is very sensitive to the privacy needs of its website visitors and subscribers and is wholly committed to maintaining privacy at the highest level. UpToDate does not sell or otherwise share subscribers' or website visitors' personal information with anyone.  ",0.0,0.0,1.0,0.0
1308,voluntarily,0.0,1.0,0.0,0.0
1309,"This information is collected only when you voluntarily provide it as part of the subscription process (""Subscriber Information"").",0.0,1.0,0.0,0.0
1310,"It is your choice whether or not you provide your Subscriber Information to UpToDate, but Subscriber Information is required for UpToDate to provide you with services (for example, access to UpToDate under a subscription agreement).",0.0,1.0,0.0,0.0
1311,"Use of Subscriber Information   Your Subscriber Information may be used internally within UpToDate. For example, UpToDate may use your Subscriber Information internally to provide subscription services to you and process your transactions, to contact you for customer service and billing purposes, to communicate to you about your subscription or changes to our service, to understand who uses the Website and to improve the Website. In addition, UpToDate reserves the right to disclose your Subscriber Information under limited circumstances in the event UpToDate believes that the Website is being used to commit unlawful acts, and/or if disclosure of your Subscriber Information is required to comply with applicable laws or regulations, or with a court or administrative order.  ",0.0,0.0,1.0,0.0
1312,"Your Subscriber Information may be used internally within UpToDate. For example, UpToDate may use your Subscriber Information internally to provide subscription services to you and process your transactions, to contact you for customer service and billing purposes, to communicate to you about your subscription or changes to our service, to understand who uses the Website and to improve the Website.",0.0,0.0,1.0,0.0
1313,"Usage Information   Non-personally identifying information (""Usage Information"") comprises information that does not identify any particular user. Examples include: information about which of UpToDate's pages are visited on an aggregate level, browser type, operating system type, or IP address.  ",0.0,0.0,1.0,0.0
1314,Your Usage Information may be disclosed internally within UpToDate,1.0,0.0,0.0,0.0
1315,"The UpToDate Website may place a text file called a ""cookie"" in the browser files of your computer.",1.0,0.0,0.0,0.0
1316,"Cookies   The UpToDate Website may place a text file called a ""cookie"" in the browser files of your computer. Cookies can be used to provide you with tailored information from the Website. The cookie itself does not contain Subscriber Information. You can set your browser to notify you when you receive a cookie, giving you the chance to decide whether or not to accept it.  ",0.0,0.0,1.0,0.0
1317,with your specific knowledge and consent,0.0,1.0,0.0,0.0
