,Clause,Implicit,Explicit,Unspecified,not-selected
0,collect,1.0,0.0,1.0,0.0
1,but not,0.0,1.0,0.0,0.0
2," The Information We Collect and Use    Non-personally identifiable information   We may collect and use non-personally identifiable information and data from you when you are visiting the Site through the standard operation of our Internet servers. Non-personally identifiable information collected from you may include user Internet Protocol (IP) addresses, browser types, domain names, and anonymous statistical data regarding your use of the Site. For example, we can tell which Internet Service Provider our visitors use, but not the names, addresses or other information about our visitors that would allow us to identify particular visitors to the Site.  ",0.0,0.0,1.0,0.0
3,cookies,1.0,0.0,0.0,0.0
4,"The Site also collects information through the use of ""cookies."" Cookies are small text files that a website can use to recognize repeat users, facilitate the user's ongoing access to and use of a website, allow the site to track usage behavior and compile aggregate data that will allow content improvements and targeted advertising. Cookies work by assigning a unique number to the user that has no meaning outside the assigning site. If you do not want information collected from you through our use of cookies, there is a simple procedure in most browsers that allows you to deny or accept the cookie feature; however, you should note that cookies may be necessary to provide you with certain features available on the Site.  ",0.0,0.0,1.0,0.0
5,"The Site also collects information through the use of ""cookies.""",1.0,0.0,0.0,0.0
6,when you specifically and knowingly provide such information voluntarily,0.0,1.0,0.0,0.0
7,provide,1.0,1.0,0.0,0.0
8,provid,0.0,1.0,0.0,0.0
9,rovide,0.0,1.0,0.0,0.0
10,"(1) when you register on the Site and when you later log-on with your user name and password; (2) when you sign-up to subscribe to a service, a newsletter, or ask to be added to our mailing lists for other products or services; (3) when you place an order for products or services; (4) when you participate in a promotional offer; (5) when you provide feedback in an online survey; (6) when you submit other content and suggestions.",0.0,1.0,0.0,0.0
11,ask,0.0,1.0,0.0,0.0
12,"In each of the instances above, we typically ask for some or all of the following information: your full name, e-mail address, phone number, physical mailing address, the type of business you are in, product preference information, any applicable identification number or password that we may require, as well as other similar information that is needed to register or subscribe you to services or offers. On occasion, we may ask for additional information to enable us to provide you with access to and use of certain other information, materials and services.  ",0.0,0.0,1.0,0.0
13,"In each of the instances above, we typically ask for some or all of the following information: your full name, e-mail address, phone number, physical mailing address, the type of business you are in, product preference information, any applicable identification number or password that we may require, as well as other similar information that is needed to register or subscribe you to services or offers.",0.0,1.0,0.0,0.0
14,when using the Site,1.0,0.0,0.0,0.0
15,The personally identifiable information you provide to us when using the Site,0.0,1.0,0.0,0.0
16,use,1.0,0.0,0.0,0.0
17,"We may from time to time use your personally identifiable information to notify you of special offers and products and services from The Hill and/or from third parties that we think may be of interest to you. It is possible that we may rent, sell or otherwise transfer to third parties personally identifiable information about you. This might include third parties such as service providers that analyze data, process transactions; advertisers; sponsors or other third parties that participate in or administer our promotions, sweepstakes, surveys or provide marketing or promotional assistance or similar such services. At any time, you can contact The Hill to request that we not share your personally identifiable information with third parties, as set forth in greater detail below.  ",0.0,0.0,1.0,0.0
18,We may from time to time use your personally identifiable information to notify you of special offers and products and services from The Hill and/or from third parties that we think may be of interest to you.,1.0,0.0,0.0,0.0
19,merge,1.0,0.0,0.0,0.0
20,"The Hill may merge your information collected on the Site with similar data obtained from third parties. We may use this enhanced personally identifiable information to notify you of special offers, updated information and new products and services from The Hill.  ",0.0,0.0,1.0,0.0
21,"The Hill may merge your information collected on the Site with similar data obtained from third parties. We may use this enhanced personally identifiable information to notify you of special offers, updated information and new products and services from The Hill.",1.0,0.0,0.0,0.0
22,"We collect information from and about you.   Contact information. For example, we might collect your name and street address. We might also collect your phone number or email.  ",0.0,0.0,1.0,0.0
23,when you buy a ticket.,0.0,0.0,1.0,0.0
24,we collect information you post in a public space on our website,0.0,0.0,1.0,0.0
25,"Information you post. For example, we collect information you post in a public space on our website or on a third-party social media site.  ",0.0,0.0,0.0,1.0
26,"Demographic information. We may collect information about events you like or products you buy. We might collect this as part of a survey, for example.  ",0.0,0.0,1.0,1.0
27,We might collect this as part of a survey,0.0,1.0,0.0,0.0
28,"Other information. If you use our website, we may collect information about the browser you're using. We might look at what site you came from, or what site you visit when you leave us. If you use our mobile app, we may collect your GPS location or your device's unique identifier. We might also collect the type of mobile device you are using, or the version of the operating system your computer or device is running. We might look at how often you use the app and where you downloaded it.  ",0.0,0.0,1.0,1.0
29,We collect information directly from you.,0.0,1.0,0.0,0.0
30,We collect information directly from you,0.0,1.0,0.0,0.0
31,passively.,1.0,0.0,0.0,0.0
32,We collect information from you passively.,1.0,0.0,0.0,0.0
33,information from you passively,1.0,0.0,0.0,0.0
34,get information about you from third parties,0.0,0.0,1.0,0.0
35,"We get information about you from third parties. For example, if you use an integrated social media feature on our websites or mobile applications. The third-party social media site will give us certain information about you. This could include your name and email address. Your activities on our sites and apps may be posted to the social media platforms.  ",0.0,0.0,0.0,1.0
36,"We use information as disclosed and described here.   We use information to respond to your requests or questions. For example, we might use your information to confirm your registration for an event or contest. If you give us your friend's information, we will only use it to provide services you requested.  ",0.0,0.0,1.0,1.0
37,Not selected,0.0,0.0,1.0,0.0
38,We use information to improve our products and services. We might use your information to customize your experience with us. This could include displaying content based upon your preferences.  ,0.0,0.0,1.0,0.0
39,We use information to look at site trends and customer interests. We may use your information to make our website and products better. We may combine information we get from you with information about you we get from third parties.  ,0.0,0.0,1.0,0.0
40,"We use information for security purposes. We may use information to protect our company, our customers, or our websites.  ",0.0,0.0,1.0,0.0
41,"We use information for marketing purposes. For example, we might send you information about special promotions or offers. We might also tell you about new features or products. These might be our own offers or products, or third-party offers or products we think you might find interesting. Or, for example, if you buy tickets from us we'll enroll you in our newsletter. We may use push notifications and your location information on our mobile apps to send you alerts regarding local events. To learn about your choices for these communications, read the choices section below.  ",0.0,0.0,1.0,1.0
42,"We use information to send you transactional communications. For example, we might send you emails about your account or a ticket purchase. We might also contact you about this policy or our website terms.  ",0.0,0.0,1.0,1.0
43,We use information as otherwise permitted by law.  ,0.0,0.0,1.0,0.0
44,our personal information collection practices,0.0,0.0,1.0,0.0
45,"You can jump to specific areas of our Privacy Policy by clicking on the links below, or you can read on for the full Privacy Policy:   Information We Collect   How We Use Personal Information We Collect   How We May Disclose Personal Information We Collect   How We May Use or Disclose Other Information We Collect   Your Options   How We Protect Your Personal Information   Cookies   Social Networking and Third Party Sites   California Users' Privacy Rights   Children's Online Privacy   International   Contact Us  ",0.0,0.0,0.0,1.0
46," Information We Collect    Whether you access our Online Services from your computer, smart phone, tablet or other mobile device, NOTMC and its agents may collect some information that identifies you or relates to you as an individual (""Personal Information""), such as your name, mailing address, telephone number, e-mail address, user name and password (for account administration), device ID, including IP address, geolocation (if using a mobile application and you consent to providing it), and additional personal information necessary for the administration of certain promotional events.  ",0.0,0.0,1.0,1.0
47,NOTMC and its agents may collect some information that identifies you or relates to you as an individual,0.0,0.0,1.0,0.0
48,"In addition, we may collect other types of data (""Other Information"") that do not reveal your identity or that do not relate directly to you or any other individual, such as Web browser and device information, including operating system, demographic information and other information provided by you that we may combine with other users of our Online Services or use on its own, mobile application usage data, aggregated information such as ""click stream"" information such as entry and exit points for our Online Services (including referring URLs or domains), certain Online Services traffic statistics, page views, and impressions, and information collected through cookies, pixel tags and other technologies described in more detail later in this Privacy Policy. In addition, when users request pages on our Online Services, our servers automatically log the IP address of the particular user. The IP address is a unique number assigned to your computer in order to identify it whenever you are surfing the web.  ",0.0,0.0,1.0,1.0
49,our servers automatically log the IP address of the particular user,1.0,0.0,0.0,0.0
50,provided by you,0.0,1.0,0.0,0.0
51,information provided by you,0.0,1.0,0.0,0.0
52,our servers automatically log,1.0,0.0,0.0,0.0
53," How We Use Personal Information We Collect    We may use Personal Information about you for purposes described in this Privacy Policy or as otherwise disclosed to you through our Online Services. For example, we may use Personal Information:  ",0.0,0.0,1.0,0.0
54,"  to process and manage your requests for products and services, including newsletters, guidebooks, and other items  ",0.0,0.0,1.0,1.0
55,"  respond to and/or fulfill your inquiries or requests, and to post your comments, ratings or statements on message boards or in our online discussion areas or forums  ",0.0,0.0,1.0,1.0
56,"  create and deliver personalized promotions, including by combining your Personal Information with Other Information, such as the amounts and types of bookings or itineraries you make and discounts or benefits you use  ",0.0,0.0,1.0,1.0
57,"  communicate with you by mail, telephone, facsimile, e-mail, mobile alerts and SMS text messaging about NOTMC or our affiliates, including communications about your itineraries or purchases, your services, accounts, sweepstakes or contests you enter, your requests for information or other items, and to update you about changes to our Online Services  ",0.0,0.0,0.0,1.0
58,"  communicate with you, including by mail, telephone, facsimile, e-mail, mobile alerts and SMS text messaging, in connection with our marketing efforts, including sending you offers and promotions that you can take advantage of through our Online Services or at relevant physical venues around or near New Orleans and offer personalized collection, filtering, and delivery of information, including serving advertisements while you are visiting New Orleans.  ",0.0,0.0,1.0,1.0
59,  allow you to send communications or gifts (including through our mobile application) to friends or family through our Online Services (conditioned on your representation to us that you are permitted to use and provide us with the recipient's name and e-mail address;  ,0.0,0.0,1.0,1.0
60,conditioned on your representation to us that you are permitted to use and provide us with the recipient's name and e-mail address,0.0,1.0,0.0,0.0
61,"  further our business or operational purposes, for example, data analysis, audits, fraud monitoring and prevention; and  ",0.0,0.0,1.0,1.0
62,"  enhance, improve or modify our Online Services, to identify usage trends, determine the effectiveness of our promotional campaigns and advertisements and to operate and expand our business activities.  ",0.0,0.0,1.0,1.0
63,"NOTMC may send you ""transactional or relationship"" communications using various electronic communication, including email and mobile communications. ""Transactional or relationship"" communications may include, for example, notices to facilitate a recent transaction you have conducted or messages with information about your existing account. If, at any time, you decide you would rather not receive these types of communications from NOTMC, you can opt out by following the ""opt-out"" or ""unsubscribe"" or ""STOP"" instructions in the relevant communication or update the contact preferences for your NOTMC account.  ",0.0,0.0,1.0,1.0
64," Other Legal Reasons    In addition, we may use or disclose your Personal Information as we deem necessary or appropriate:     under applicable law, including laws outside your country of residence;    to respond to requests from public and government authorities including public and government authorities outside your country of residence;    to comply with subpoenas and other legal processes;    to pursue available remedies or limit damages we may sustain;    to protect our operations or those of any of our Affiliates;    to protect the rights, privacy, safety or property of NOTMC, you and others; and    to enforce our Terms of Use and any other terms and conditions.  ",0.0,0.0,0.0,1.0
65," How We May Use and Disclose Other Information We Collect    Similarly, we generally use Other Information for any purpose not prohibited by law. In particular, we may collect, compile, store, publish, promote, report, sell, or otherwise disclose or use any and all Other Information, provided that such information does not personally identify you. Other Information that we collect generally will not personally identify you or be correlated to you individually for external purposes.  ",0.0,0.0,1.0,1.0
66,Where we combine Other Information with Personal Information,0.0,0.0,1.0,0.0
67,"Where we combine Other Information with Personal Information in a way that can identify you or be used to identify you personally, we will treat that information as Personal Information, subject to the provisions of this Privacy Policy.  ",0.0,0.0,0.0,1.0
68," How We Use Cookies    NOTMC and its agents use Cookies so that we can improve your online experience - for example, by remembering you when you come back to visit the Websites, and making the content you see more relevant to you. Cookies also enable us to track online purchases made through our Online Services.  ",0.0,0.0,1.0,1.0
69," Online Advertising    NOTMC also uses Cookies and other technologies such as pixel tags, web beacons and clear GIF files, to help manage our online advertising program. These technologies are provided by our advertising management partners and enable them to recognize a unique Cookie that has been placed on your Web browser, which in turn enables us and these advertising management partners to learn which advertisements bring users to our Online Services.  ",0.0,0.0,1.0,1.0
70,"NOTMC and our advertising management partners also may use these technologies to track the actions of users of our Online Services, to measure statistics of our marketing efforts, and to deliver advertisements on our Online Services that may be more relevant to individual consumers and to otherwise improve the experience of consumers using our Online Services.  ",0.0,0.0,1.0,1.0
71,unless you choose to provide that information.,1.0,0.0,0.0,0.0
72,choose to provide that information,0.0,1.0,0.0,0.0
73,when you visit our web site,1.0,0.0,0.0,0.0
74,Automatically,1.0,0.0,0.0,0.0
75," Information Collected and Stored Automatically    When you visit USA.gov, we may store some or all of the following: the Internet protocol address from which you access USA.gov, date and time, the name of the web site from which you linked to USA.gov, the name of the file or words you searched, items clicked on a page, and the browser and operating system used.  ",0.0,0.0,0.0,1.0
76,"the Internet protocol address from which you access USA.gov, date and time, the name of the web site from which you linked to USA.gov, the name of the file or words you searched, items clicked on a page, and the browser and operating system used",1.0,0.0,0.0,0.0
77,"This information is used to measure the number of visitors to the various sections of our site and identify system performance or problem areas. We also use this information to help us develop the site, analyze patterns of usage, and to make the site more useful. This information is not used for associating search terms or patterns of site navigation with individual users. USA.gov may anonymize and provide this information to third party entities for the purposes of research analysis. We do not share or sell visitor data for the purposes of advertising, marketing, or any other commercial purpose.  ",0.0,0.0,1.0,1.0
78,"Except for authorized law enforcement investigations, no other attempts are made to identify individual users or their usage habits. Raw data logs are used for no other purposes and are scheduled for regular destruction in accordance with National Archives and Records Administration guidelines.  ",0.0,0.0,1.0,1.0
79,this website places on your web browser,1.0,0.0,0.0,0.0
80," Use of Persistent Cookies    Like many websites, USA.gov uses ""persistent cookie"" technology. A persistent cookie is a small text file that this website places on your web browser so that it can gather anonymous summary demographic information, and remember your browser when it is used to visit our site again laterkind of like cookie crumbs! (Hence the name.) These cookies uniquely identify a browser on a computer, but never a person. In other words, if the same person uses Chrome and Internet Explorer, two unique browser cookies will be assigned, one for each browser, so that person will be counted as two different visitors because visits are based on browsers, not computers or persons. We use persistent cookies in two ways, both of which enhance your experience on USA.gov while also protecting your privacy:  ",0.0,0.0,0.0,1.0
81,"USA.gov uses ""persistent cookie"" technology",1.0,0.0,0.0,0.0
82,"  To remember you when your browser comes back to the site, so we don't invite you to take our customer satisfaction survey every time you visit. Our customer satisfaction survey uses a persistent cookie to ensure we won't invite you to take a customer satisfaction survey within 90 days of completing a survey on USA.gov.  ",0.0,0.0,0.0,1.0
83,  To get aggregate metrics on site usage to understand how people are using the site and how we can make it better. We use web metrics services to track activity on USA.gov. Government agencies only ever receive traffic statistics anonymously and in the aggregate.  ,0.0,0.0,0.0,1.0
84,track activity,1.0,0.0,0.0,0.0
85,"  To gather anonymous summary demographic information about our visitors such as gender, age range, and areas of interest for adults over the age of 18. We do this by using Google Demographic and Interests reports. When you visit a website that has partnered with the Google Display Network, Google stores a number in your browser using a persistent cookie to remember your visits. This number uniquely identifies a web browser, not a specific person. Browsers may be associated with a demographic category, such as gender or age range, based on the sites that were visited. This demographic information is used to help us better understand our visitors' interests and needs to more effectively develop content to serve you.  ",0.0,0.0,0.0,1.0
86,"When you visit a website that has partnered with the Google Display Network, Google stores a number in your browser using a persistent cookie to remember your visits.",1.0,0.0,0.0,0.0
87," Social Media Sites    While USA.gov manages presence on social media sites (e.g., Facebook, Twitter, YouTube) in order to share government information and engage with the public, we do not collect any Personally Identifiable Information through those sites. We also do not use personal information made available by the user to these third-party sites.  ",0.0,0.0,1.0,1.0
88," If You Send Us Personal Information    We do not collect personal information for any purpose other than to respond to your request. The only personal information that we collect is what you decide to give us by ordering publications, sending us an e-mail, or subscribing to our e-mail subscription services. If you choose to provide us with personal information like filling out a Contact Us form, with an e-mail address and ZIP code, and submitting it to us through the website we use that information to respond to your message, and to help get you the information you requested. Similarly, if you order a publication from us, we will collect your name, and mailing address to fulfill your order.  ",0.0,0.0,1.0,1.0
89,"collect your name, and mailing address",0.0,1.0,0.0,0.0
90,"We only share the information you give us with another government agency if your question relates to that agency, or as otherwise required by law. USA.gov never collects information or creates individual profiles for commercial marketing.",0.0,0.0,1.0,0.0
91,"Amazon.com knows that you care how information about you is used and shared, and we appreciate your trust that we will do so carefully and sensibly. This notice describes our privacy policy. By visiting Amazon.com, you are accepting the practices described in this Privacy Notice.     What Personal Information About Customers Does Amazon.com Gather?     What About Cookies?     Does Amazon.com Share the Information It Receives?     How Secure Is Information About Me?     What About Third-Party Advertisers and Links to Other Websites?     Which Information Can I Access?     What Choices Do I Have?     Are Children Allowed to Use Amazon.com?     Does Amazon.com Participate in the Safe Harbor Program?     Conditions of Use, Notices, and Revisions     Examples of Information Collected  ",0.0,0.0,0.0,1.0
92,What,0.0,0.0,1.0,0.0
93,The information we learn from customers helps us personalize and continually improve your Amazon experience.,1.0,0.0,0.0,0.0
94,Here are the types of information we gather.,0.0,0.0,1.0,0.0
95, What Personal Information About Customers Does Amazon.com Gather?    The information we learn from customers helps us personalize and continually improve your Amazon experience. Here are the types of information we gather.  ,0.0,0.0,0.0,1.0
96,"  Information You Give Us: We receive and store any information you enter on our Web site or give us in any other way. Click here to see examples of what we collect. You can choose not to provide certain information, but then you might not be able to take advantage of many of our features. We use the information that you provide for such purposes as responding to your requests, customizing future shopping for you, improving our stores, and communicating with you.  ",0.0,0.0,0.0,1.0
97,any information you enter on our Web site or,0.0,1.0,0.0,0.0
98,you enter on our Web site,0.0,1.0,0.0,0.0
99,give us in any other way,0.0,0.0,1.0,0.0
100,you enter on our Web site or give us in any other way,0.0,1.0,0.0,0.0
101,whenever you interact with us,1.0,0.0,0.0,0.0
102,"  Automatic Information: We receive and store certain types of information whenever you interact with us. For example, like many Web sites, we use ""cookies,"" and we obtain certain types of information when your Web browser accesses Amazon.com or advertisements and other content served by or on behalf of Amazon.com on other Web sites. Click here to see examples of the information we receive.  ",0.0,0.0,1.0,1.0
103,whenever you interact with us.,1.0,0.0,1.0,0.0
104,Automatic Information,1.0,0.0,0.0,0.0
105,"When you download or use apps created by Amazon or our subsidiaries, we may receive information about your location and your mobile device, including a unique identifier for your device",1.0,0.0,0.0,0.0
